,id,title,all
1016,11232,Kate & Leopold,james mangold meg ryan hugh jackman liev schreiber breckin meyer comedy fantasy romance science fiction lover (female) love of one's life time travel kiss past secret love fish out of water
1017,1636,Bedazzled,harold ramis elizabeth hurley brendan fraser frances o'connor orlando jones fantasy comedy romance love of one's life mephisto wish sale of soul pact with the devil teuflisch
1018,2148,The Cotton Club,francis ford coppola richard gere gregory hines diane lane lonette mckee music drama crime romance jazz jazz musician musical mafia
1019,5176,3:10 to Yuma,james mangold russell crowe christian bale logan lerman dallas roberts western saloon hero liberation of prisoners transport of prisoners wilderness dying and death race against time railway car stetson rivalry gang gunfight crime family psychological dishonesty heroic mission righting the wronged chases and races parents and children mind and soul
1020,260346,Taken 3,olivier megaton liam neeson forest whitaker maggie grace famke janssen thriller action revenge murder on the run fugitive framed father daughter relationship framed for murder
1021,1389,Out of Sight,steven soderbergh george clooney jennifer lopez ving rhames don cheadle romance comedy crime journalist bedroom purse trunk elmore leonard
1022,9894,The Cable Guy,ben stiller jim carrey matthew broderick leslie mann jack black comedy drama thriller prison prostitute karaoke dark comedy cable guy
1023,7504,Earth,deepa mehta aamir khan nandita das maia sethna kitu gidwani drama based on novel war of independence period drama woman director partition 1940s lahore
1024,8592,Dick Tracy,warren beatty warren beatty al pacino madonna charlie korsmo adventure action comedy thriller crime corruption crime fighter gangster boss investigation based on comic strip policeman
1025,913,The Thomas Crown Affair,john mctiernan pierce brosnan rene russo denis leary ben gazzara drama crime romance martinique claude monet famous painting glider insurance agent missing painting stolen painting valuable painting rich people
1026,11091,Riding in Cars with Boys,penny marshall drew barrymore steve zahn adam garcia brittany murphy comedy drama romance baby becoming an adult puberty dream drug addiction wife unwillingly pregnant writer youth marriage problems woman director
1027,1368,First Blood,ted kotcheff sylvester stallone richard crenna brian dennehy bill mckinney action adventure thriller war prison vietnam veteran falsely accused police brutality sheriff guerrilla submachine gun gun destroy self-defense vietnam vietnam war prosecution dying and death village and town police operation attempt to escape matter of life and death survivor tramp national guard weapon firearm police escape
1028,593,Solaris,andrei tarkovsky donatas banionis natalya bondarchuk jüri järvet anatoliy solonitsyn drama science fiction adventure mystery 1970s loss of sense of reality extraterrestrial technology subconsciousness russian hallucination space travel astronaut soviet
1029,5393,Happily N'Ever After,yvette kaplan george carlin andy dick sarah michelle gellar lisa kaplan animation comedy family fantasy science fiction dwarves cinderella wolf bad mother-in-law prince fairy tale little red riding hood step mother wizardry princess sleeping beauty rumpelstilzchen good and bad intern woman director
1030,9095,Mary Reilly,stephen frears julia roberts john malkovich george cole michael gambon drama horror thriller romance servant monster laboratory jekyll and hyde housemaid 19th century
1031,8874,My Best Friend's Wedding,p.j. hogan julia roberts dermot mulroney cameron diaz rupert everett comedy romance karaoke marriage proposal new love love of one's life kiss man-woman relation secret love wedding
1032,11467,America's Sweethearts,joe roth julia roberts billy crystal catherine zeta-jones john cusack comedy romance film business film producer wife husband relationship fictitious marriage married couple marriage crisis
1033,320,Insomnia,christopher nolan al pacino robin williams hilary swank maura tierney crime mystery thriller detective confession fbi homicide blackmail suspect love murder los angeles teenager neo-noir
1034,199,Star Trek: First Contact,jonathan frakes patrick stewart jonathan frakes brent spiner levar burton science fiction action adventure thriller federation starfleet borg enterprise-e cyborg montana resistance inventor repayment obsession business start-up space opera
1035,20533,Jonah Hex,jimmy hayward josh brolin john malkovich megan fox michael fassbender action western drama fantasy thriller gunslinger usa dc comics hell facial scar death confederate tomahawk
1036,10684,Courage Under Fire,edward zwick denzel washington meg ryan lou diamond phillips matt damon drama thriller mystery war gulf war pilot u.s. army praise rescue mission dead soldier tank medal
1037,1624,Liar Liar,tom shadyac jim carrey maura tierney cary elwes jennifer tilly comedy california workaholic birthday lie pregnancy and birth wish 1990s
1038,325789,The Infiltrator,brad furman bryan cranston diane kruger john leguizamo daniel mays crime drama thriller undercover biography drug drug lord
1039,113464,Inchon,terence young laurence olivier jacqueline bisset ben gazzara toshirō mifune drama history war 
1040,888,The Flintstones,brian levant john goodman elizabeth perkins rick moranis rosie o'donnell fantasy comedy family manager jealousy bad mother-in-law adoption family's daily life stone age plan friendship best friend dinosaur
1041,82675,Taken 2,olivier megaton liam neeson maggie grace famke janssen rade serbedzija action crime thriller kidnapping turkey police chase bag over head violence fbi agent teenage daughter stealing a car ex-husband ex-wife relationship albanian u.s. embassy killed in an elevator security guard killed
1042,4256,Scary Movie 3,david zucker pamela anderson jenny mccarthy marny eng charlie sheen comedy horror spoof
1043,1493,Miss Congeniality,donald petrie sandra bullock benjamin bratt michael caine candice bergen comedy crime action undercover agent beauty contest terrorism
1044,88751,Journey to the Center of the Earth,eric brevig brendan fraser josh hutcherson anita briem seth meyers action science fiction adventure comedy family volcano prehistoric dinosaur prehistoric creature 3d
1045,11130,The Princess Diaries 2: Royal Engagement,garry marshall anne hathaway julie andrews héctor elizondo john rhys-davies comedy drama family romance coronation duty marriage falling in love
1046,9944,The Pelican Brief,alan j. pakula julia roberts denzel washington sam shepard william atherton drama mystery thriller crime judge professor mission of murder supreme court
1047,10731,The Client,joel schumacher susan sarandon tommy lee jones mary-louise parker anthony lapaglia drama thriller crime mystery suicide brother brother relationship witness protection principal witness  brother investigation search for witnesses lawyer gangster
1048,7350,The Bucket List,rob reiner jack nicholson morgan freeman sean hayes beverly todd drama comedy africa himalaya brain tumor wife husband relationship sense of life male friendship safari dying and death wish journey round the world terminal illness billionaire father daughter relationship estranged father elderly bucket list taj mahal
1049,9869,Patriot Games,phillip noyce harrison ford anne archer patrick bergin thora birch drama action thriller crime assassination assassin repayment ira jack ryan
1050,4379,Monster-in-Law,robert luketic jennifer lopez jane fonda michael vartan wanda sykes romance comedy bad mother-in-law surgeon dogsitter falling in love
1051,146233,Prisoners,denis villeneuve hugh jackman jake gyllenhaal paul dano maria bello drama thriller crime pennsylvania kidnapping maze vigilante rural setting candlelight vigil
1052,2034,Training Day,antoine fuqua denzel washington ethan hawke scott glenn tom berenger action crime drama thriller police brutality war on drugs drug traffic drug dealer los angeles gang member mexican american barrio cholo
1053,926,Galaxy Quest,dean parisot tim allen sigourney weaver alan rickman tony shalhoub comedy family science fiction space battle spaceship spoof fictional tv show
1054,4248,Scary Movie 2,keenen ivory wayans anna faris marlon wayans james debello shawn wayans comedy sex exorcism secret door
1055,64328,The Muppets,james bobin amy adams jason segel emily blunt john krasinski comedy family music musical the muppets robot oil tycoon studio tour duringcreditsstinger
1056,36647,Blade,stephen norrington wesley snipes stephen dorff kris kristofferson n'bushe wright horror action suicide hero vampire bite fistfight supernatural vampire hunter superhero rivalry tragic hero good vs evil one man army extreme violence martial arts master scientist violence disarming someone blade machine gun english subtitles in original hypodermic needle microscope secret headquarters bullet dodging bullet time kicked in the groin x rayed skeleton mouth guard escapade imaginary deadly master warrior supernatural ability fang vamp
1057,7214,Coach Carter,thomas carter samuel l. jackson rob brown robert ri'chard rick gonzalez drama black people autoritian education sport high school scholarship basketball violence in schools teacher teachers and students
1058,1537,Changing Lanes,roger michell ben affleck samuel l. jackson kim staunton toni collette action adventure crime thriller new york custody battle suspense lawyer
1059,9360,Anaconda,luis llosa jennifer lopez ice cube jon voight eric stoltz adventure horror thriller amazon jungle anaconda film crew killer snake river boat amazon river animal horror
1060,6282,Coyote Ugly,david mcnally piper perabo adam garcia john goodman izabella miko comedy bar musical beautiful woman
1061,508,Love Actually,richard curtis keira knightley heike makatsch emma thompson laura linney comedy romance drama london england male nudity female nudity love at first sight usa president marseille office christmas party marriage proposal bars and restaurants press conference language barrier prime minister rock star tv show metal detector war on terror school performance multiple storylines
1062,9487,A Bug's Life,andrew stanton kevin spacey julia louis-dreyfus hayden panettiere phyllis diller adventure animation comedy family winter fight ant invention collector ant-hill kids and family grass duringcreditsstinger
1063,768,From Hell,albert hughes johnny depp heather graham ian holm robbie coltrane horror mystery thriller loss of family drug addiction jack the ripper
1064,2636,The Specialist,luis llosa sylvester stallone sharon stone james woods rod steiger action thriller explosive revenge explosives expert
1065,10478,Tin Cup,ron shelton kevin costner don johnson cheech marin george perez comedy drama romance lover (female) golf man-woman relation sport woman between two men
1066,27983,"Yours, Mine and Ours",melville shavelson lucille ball henry fonda van johnson tom bosley comedy drama family nurse widow children parent sibling
1067,9981,Kicking & Screaming,jesse dylan will ferrell robert duvall kate walsh musetta vander romance comedy family father son relationship generations confilct sport amateur soccer soccer coach
1068,7453,The Hitchhiker's Guide to the Galaxy,garth jennings martin freeman zooey deschanel sam rockwell yasiin bey adventure comedy family science fiction bureaucracy england dolphin android based on novel chase space travel galaxy spaceship alien stop motion survival hitchhiker robot alien invasion everyman hyperspace meaning of life based on radio show alien attack bathrobe destruction of earth intergalactic travel islington england talking robot
1069,15045,Fat Albert,joel zwick kenan thompson shedrack anderson iii jermaine williams keith robinson comedy drama family 
1070,7737,Resident Evil: Extinction,russell mulcahy milla jovovich oded fehr ali larter iain glen horror action science fiction clone mutant post-apocalyptic dystopia conspiracy evil corporation zombie based on video game
1071,232672,Blended,frank coraci drew barrymore adam sandler wendi mclendon-covey bella thorne comedy africa blind date relationship family vacation family
1072,17379,Last Holiday,wayne wang queen latifah ll cool j timothy hutton giancarlo esposito adventure comedy drama 
1073,8987,The River Wild,curtis hanson meryl streep david strathairn kevin bacon benjamin bratt action adventure crime thriller river robber boston bank robber marriage crisis hostage-taking rafting criminal white water rafting
1074,11359,The Indian in the Cupboard,frank oz hal scardino litefoot lindsay crouse richard jenkins adventure family fantasy cupboard games puppet parallel world toy comes to life
1075,82525,Savages,oliver stone blake lively taylor kitsch aaron taylor-johnson benicio del toro crime drama thriller widow american abroad eye gouging dea agent shot in the shoulder gun in mouth filmed killing southern california improvised explosive device surrogate daughter shot in the throat laguna beach california enforcer gardner skull mask dea
1076,9759,Cellular,david r. ellis chris evans kim basinger jason statham jessica biel action adventure crime thriller bank mobile phone telephone weapon police duringcreditsstinger
1077,9486,Johnny English,peter howitt rowan atkinson john malkovich natalie imbruglia tasha de vasconcelos adventure action comedy spy hero queen intelligence coronation funeral secret agent queen elisabeth ii weapon spoof explosion agent pen duringcreditsstinger
1078,9906,The Ant Bully,john a. davis julia roberts meryl streep nicolas cage paul giamatti fantasy adventure animation comedy family ant child hero shrinking ant-hill children
1079,841,Dune,david lynch kyle maclachlan francesca annis leonardo cimino brad dourif action science fiction adventure prophecy witch monster telepathy atomic bomb space marine emperor mutation insurgence space travel guild duke water chosen one dystopia jihad spice war messiah denunciation
1080,4688,Across the Universe,julie taymor evan rachel wood jim sturgess joe anderson dana fuchs adventure drama music romance riot protest musical music cultural difference university fantasy sequence anti war police arrest march woman director 1960s
1081,4148,Revolutionary Road,sam mendes leonardo dicaprio kate winslet michael shannon kathryn hahn drama romance adultery jealousy infidelity career marriage crisis connecticut
1082,2207,16 Blocks,richard donner bruce willis yasiin bey david morse jenna stern action adventure crime thriller mission of murder male bonding doing the right thing people change
1083,9381,Babylon A.D.,mathieu kassovitz vin diesel michelle yeoh mélanie thierry lambert wilson action adventure science fiction thriller submarine baby secret future mercenary prosecution protection dystopia moral conflict smuggling vision pregnant cyberpunk sect
1084,9625,The Glimmer Man,john gray steven seagal keenen ivory wayans bob gunton brian cox action adventure crime drama thriller secret agent past cop series of murders homicide detective
1085,9304,Multiplicity,harold ramis michael keaton andie macdowell harris yulin eugene levy comedy fantasy science fiction clone mistake in person cloning experiment gone wrong construction
1086,20856,Aliens in the Attic,john schultz carter jenkins austin butler kevin nealon robert hoffman adventure comedy family fantasy science fiction alien comedy duringcreditsstinger beforecreditsstinger live action and animation
1087,5955,The Pledge,sean penn jack nicholson aaron eckhart helen mirren robin wright crime drama mystery thriller promise murder drawing porcupine pledge retirement party criminal profile
1088,9899,The Producers,susan stroman matthew broderick uma thurman will ferrell eileen essell comedy music cheating adolf hitler success music blonde funny nazi producer broadway musical aftercreditsstinger woman director
1089,9826,The Phantom,simon wincer billy zane kristy swanson treat williams catherine zeta-jones adventure action secret identity gold gangster boss phantom silver power battle for power jade based on comic book jungle masked hero crystal skull
1090,21355,All the Pretty Horses,billy bob thornton matt damon henry thomas penélope cruz sam shepard drama romance western dancing chess prisoner coffin wrong accusal ranch airplane beating jail rifle corpse lasso cautery
1091,10858,Nixon,oliver stone anthony hopkins joan allen powers boothe ed harris history drama usa president presidential election watergate scandal biography government historical figure
1092,11439,The Ghost Writer,roman polanski ewan mcgregor pierce brosnan jon bernthal kim cattrall thriller mystery london england cia war crimes tony blair author
1093,9457,Deep Rising,stephen sommers treat williams famke janssen anthony heald kevin j. o'connor adventure action horror science fiction ocean liner sea monster jewel heist armed robbery
1094,12412,Miracle at St. Anna,spike lee derek luke michael ealy laz alonso john turturro drama war black people world war ii toscana village soldier partisan
1095,1494,Curse of the Golden Flower,zhang yimou chow yun-fat gong li jay chou liu ye action drama fantasy poison china martial arts swordplay fight toxication secret society passion planned murder power palace plan battle for power tang dynasty pomp conspiracy of murder heir to the throne marriage crisis secret love
1096,13184,Bangkok Dangerous,danny pang nicolas cage shahkrit yamnarm charlie yeung panward hemmanee action crime thriller assassin asia gun deaf-mute hitman bangkok thailand strip club apprentice video surveillance remake murder betrayal mafia shootout boat chase explosion foot chase killer gunshot flashback motorcycle chase crisis of conscience
1097,2185,Big Trouble,barry sonnenfeld tim allen rene russo patrick warburton ben foster action comedy thriller gadfly
1098,6639,Love in the Time of Cholera,mike newell javier bardem unax ugalde benjamin bratt catalina sandino moreno drama romance sex marriage proposal new love colombia letter love letter dying and death ship marriage cholera teacher principal doctor extramarital affair emotions
1099,38153,Shadow Conspiracy,george p. cosmatos charlie sheen donald sutherland linda hamilton stephen lang action thriller 
1100,58233,Johnny English Reborn,oliver parker rowan atkinson dominic west gillian anderson rosamund pike crime adventure action comedy thriller buddhist monk cooking prime minister kitchen secret agent sequel mind control james bond spoof incompetence female boss klutz aftercreditsstinger assassination attempt
1101,116977,Foodfight!,lawrence kasanoff charlie sheen wayne brady hilary duff eva longoria animation action comedy family supermarket fight product placement computer animation food
1102,68734,Argo,ben affleck ben affleck bryan cranston alan arkin john goodman drama thriller cia wife husband relationship document revolution hiding place canadian press conference biography hanged man american abroad crane subtitled scene movie poster based on article extraction iran hostage crisis sweatshop intelligence agent film studio langley virginia 1980s
1103,5503,The Fugitive,andrew davis harrison ford tommy lee jones sela ward julianne moore adventure action thriller crime mystery chicago showdown undercover surgeon death sentence doomed man lethal injection chase remake betrayal on the run train crash escape fugitive based on tv series u.s. marshal doctor explosion home invasion disguise one armed man framed for murder flashback corrupt cop manhunt bus accident storm drain
1104,27573,The Bounty Hunter,andy tennant gerard butler jennifer aniston gio perez siobhan fallon action bounty hunter ex-husband ex-wife relationship
1105,819,Sleepers,barry levinson robert de niro brad pitt kevin bacon jason patric crime drama thriller child abuse sadistic sexual abuse pastor repayment juvenile prison court case pub court juvenile delinquent child
1106,1369,Rambo: First Blood Part II,george p. cosmatos sylvester stallone richard crenna charles napier steven berkoff action adventure thriller war usa vietnam veteran submachine gun prisoner prisoners of war liberation of prisoners liberation vietnam vietnam war chase machinegun u.s. army forest photography government war revenge soldier agent denunciation
1107,9623,The Juror,brian gibson demi moore alec baldwin joseph gordon-levitt anne heche drama thriller jurors blackmail court case son trial courtroom
1108,10895,Pinocchio,ben sharpsteen mel blanc don brodie walter catlett marion darlington animation family italy lie magic fairy pinocchio carnival wish boy nose puppet animation pool conscience jackass figaro sneezing toy comes to life
1109,10935,Heaven's Gate,michael cimino kris kristofferson christopher walken john hurt isabelle huppert action drama history western montana showdown brothel marshal dance immigrant studies idealist
1110,834,Underworld: Evolution,len wiseman kate beckinsale scott speedman tony curran shane brolly fantasy action science fiction thriller budapest key vampire light werewolf evolution fang vamp
1111,228066,Victor Frankenstein,paul mcguigan james mcavoy daniel radcliffe jessica brown findlay andrew scott drama science fiction thriller london england human experimentation frankenstein reanimated corpse frankenstein's monster science experiment 19th century
1112,711,Finding Forrester,gus van sant sean connery rob brown f. murray abraham anna paquin drama upper class brother brother relationship scotland poetry based on novel mentor becoming an adult professor literature intellectually gifted plagiarism literature competition private school manuscript seclusion pulitzer prize dying and death idol friendship unsociability high school scholarship father figure
1113,10468,28 Days,betty thomas sandra bullock viggo mortensen dominic west elizabeth perkins comedy drama alcoholism urteil car crash wedding withdrawal woman director
1114,10027,Unleashed,louis leterrier jet li morgan freeman bob hoskins vincent regan action crime martial arts hitman serial killer
1115,11812,The Sweetest Thing,roger kumble cameron diaz christina applegate thomas jane selma blair romance comedy roommate marriage aftercreditsstinger duringcreditsstinger
1116,37233,The Firm,sydney pollack tom cruise jeanne tripplehorn gene hackman holly hunter drama mystery thriller fbi law tennessee lawyer law firm bar exam
1117,37950,Charlie St. Cloud,burr steers zac efron amanda crew charlie tahan augustus prew drama brother brother relationship based on novel sailing ghost young adult
1118,27582,The Mechanic,simon west jason statham ben foster donald sutherland mini anden action thriller crime poison chicago prostitute martial arts assassin airport cemetery boat hitman chase machinegun cover-up beautiful woman car crash
1119,64688,21 Jump Street,phil lord channing tatum jonah hill brie larson dave franco action comedy crime male friendship high school parody crude humor based on tv series undercover cop buddy cop buddy comedy duringcreditsstinger
1120,509,Notting Hill,roger michell julia roberts hugh grant gina mckee tim mcinnerny romance comedy drama london england bookshop birthday new love film maker paparazzi press conference wheelchair bath tub cohabitant friendship fame celebration movie star spectacle
1121,7443,Chicken Run,nick park mel gibson miranda richardson timothy spall imelda staunton animation comedy family chicken freedom escape chicken farm pie machine
1122,5966,Along Came Polly,john hamburg ben stiller jennifer aniston philip seymour hoffman debra messing comedy romance beach honeymoon bride chance risk relation long island romantic comedy comedy scuba diving unfaithfulness los angeles art gallery dance class opposites attract caribbean commitment dance club neurotic bagpipes chance encounter insurance risk manager
1123,11066,Boomerang,reginald hudlin eddie murphy robin givens halle berry david alan grier comedy romance role of women ladykiller success ladies' man chefin casanova womanizer
1124,136795,The Heat,paul feig sandra bullock melissa mccarthy demián bichir michael rapaport action comedy crime boston fbi buddy comedy
1125,8095,Cleopatra,joseph l. mankiewicz elizabeth taylor richard burton rex harrison roddy mcdowall drama history romance ancient rome historical figure cleopatra julius caesar
1126,87826,Here Comes the Boom,frank coraci salma hayek kevin james henry winkler joe rogan comedy high school teacher prize money physics teacher fighting movie budget cutting
1127,11560,High Crimes,carl franklin ashley judd morgan freeman jim caviezel amanda peet drama mystery thriller crime based on novel witness village court love murder lawyer defense trial justice husband u.s. marine arrested classified
1128,25189,The Mirror Has Two Faces,barbra streisand barbra streisand jeff bridges lauren bacall george segal comedy drama romance sex professor wedding woman director columbia university
1129,2637,The Mothman Prophecies,mark pellington richard gere laura linney will patton bob tracey drama horror mystery based on novel small town dream motel hallucination bridge alien life-form warning tumor west virginia urban legend premonition telephone call hospital reporter psychic car wreck death of wife mothman mysterious events chemical plant
1130,18480,Brüno,larry charles sacha baron cohen richard bey ron paul gustaf hammarsten comedy gay fame mockumentary hollywood lgbt duringcreditsstinger
1131,709,Licence to Kill,john glen timothy dalton carey lowell robert davi talisa soto adventure action thriller corruption florida secret identity liberation of prisoners drug traffic floatplane transport of prisoners tank car florida keys coast guard airplane british secret service
1132,49730,Red Riding Hood,catherine hardwicke amanda seyfried gary oldman billy burke shiloh fernandez fantasy thriller horror winter fantasy fairy tale hood werewolf aftercreditsstinger duringcreditsstinger woman director red riding hood
