,id,title,all
3337,238,The Godfather,francis ford coppola marlon brando al pacino james caan richard s. castellano drama crime italy love at first sight loss of father patriarch organized crime mafia lawyer italian american crime family rise to power mob boss 1940s
3338,535,Flashdance,adrian lyne jennifer beals michael nouri lilia skala kyle t. heffner drama music romance dancing dance locksmith welder
3339,19913,(500) Days of Summer,marc webb joseph gordon-levitt zooey deschanel chloë grace moretz geoffrey arend comedy drama romance date sex jealousy fight architect gallery interview sister party love friends fate los angeles summer ikea year heartache
3340,713,The Piano,jane campion holly hunter harvey keitel sam neill anna paquin drama romance love triangle scotland mother adultery sexuality jealousy culture clash isolation eroticism strangeness penalty violent husband new zealand maori arranged marriage piano lessons settler wilderness deceived husband marriage secret love woman director
3341,77930,Magic Mike,steven soderbergh channing tatum matthew mcconaughey alex pettyfer cody horn drama comedy dancing florida strip club male stripper novice
3342,10727,Darkness Falls,jonathan liebesman chaney kley emma caulfield lee cormie grant piro thriller horror witch loss of mother small town death penalty lighthouse cowardliness spirit witch hunt
3343,253,Live and Let Die,guy hamilton roger moore yaphet kotto jane seymour clifton james adventure action thriller london england new york bomb england spy sheriff dual identity secret identity drug traffic tarot cards heroin crocodile jamaica secret mission secret intelligence service motorboat drug smuggle voodoo tombstone aftercreditsstinger
3344,17908,My Dog Skip,jay russell frankie muniz diane lane kevin bacon luke wilson comedy drama family mississippi childhood memory dog
3345,8390,"Definitely, Maybe",adam brooks ryan reynolds abigail breslin elizabeth banks isla fisher comedy romance lovesickness love of one's life narration lovers kiss daughter affection relation make a match sex education relationship divorce father daughter relationship past relationship
3346,57119,Jumping the Broom,salim akil paula patton julie bowen meagan good mike epps comedy african american wedding class differences martha's vineyard
3347,3291,"Good Night, and Good Luck.",george clooney david strathairn jeff daniels alex borstein rose abdoo drama history telecaster communist political activism tv show politician government anti-communism
3348,398,Capote,bennett miller philip seymour hoffman allie mickelson craig archibald bronwen coleman crime drama gay self-fulfilling prophecy based on novel journalism identity dream literature research literature dying and death biography
3349,8068,Desperado,robert rodriguez antonio banderas salma hayek joaquim de almeida cheech marin thriller action crime gunslinger anti terror ambush mexico showdown guitar nudity hitman bartender revenge tragic hero shootout mariachi explosion extreme violence brutality drug lord leg brace concealed weapon flashback bookstore
3350,10803,Logan's Run,michael anderson michael york richard jordan jenny agutter roscoe lee browne adventure action romance science fiction female nudity killer robot nudity utopia teleportation post-apocalyptic dystopia plastic surgery escape fugitive robot domed city dystopic future totalitarianism population control
3351,682,The Man with the Golden Gun,guy hamilton roger moore christopher lee britt ekland maud adams adventure action thriller london england england martial arts assassin exotic island gold hitman secret mission villain bangkok thailand floatplane karate hong kong duel pistol secret service aftercreditsstinger
3352,10117,Action Jackson,craig r. baxley carl weathers craig t. nelson vanity sharon stone action adventure comedy crime drama showdown suspicion of murder boxer suspension organized crime shootout car chase detroit drug addict one against many megalomaniac maverick cop framed for murder bar fight exploding boat action hero
3353,9392,The Descent,neil marshall shauna macdonald natalie mendoza alex reid saskia mulder adventure horror mutant expedition cave darkness rope climbing bestie appalachia friends female protagonist survival horror
3354,24977,Michael Jordan to the Max,james d. stern michael jordan phil jackson bob costas bill murray documentary sport
3355,79316,Devil's Due,matt bettinelli-olpin allison miller zach gilford sam anderson robert belushi horror found footage
3356,2074,Flirting with Disaster,david o. russell ben stiller patricia arquette téa leoni mary tyler moore comedy romance lsd looking for  birth parents half-brother independent film
3357,1696,The Devil's Rejects,rob zombie sid haig bill moseley sheri moon zombie william forsythe drama horror crime sadistic killing fire sheriff bounty hunter cocaine motel ax sadism psychopath road trip sequel murder rampage antisocial personality disorder serial killer shootout torture corpse sadist extreme violence brutality maniac violence stabbing killing spree held at gunpoint cult film roadkill macabre misogynist road movie killer clown painted face evil clown homicidal maniac sadistic horror
3358,308639,Dope,rick famuyiwa shameik moore kiersey clemons tony revolori zoë kravitz crime drama comedy california hip-hop harvard university geek coming of age teenager drug high school student
3359,22314,In Too Deep,michael rymer omar epps ll cool j nia long stanley tucci drama action thriller crime 
3360,2662,House of 1000 Corpses,rob zombie sid haig bill moseley sheri moon zombie karen black horror upper class halloween psychopath urban legend youth satanic ritual
3361,77156,Alien Zone,sharron miller john ericson ivor francis judith novgrod burr debenning horror action thriller science fiction 
3362,12573,A Serious Man,joel coen michael stuhlbarg richard kind fred melamed sari lennick comedy drama professor dark comedy telephone call aftercreditsstinger 1960s
3363,44718,Get Low,aaron schneider bill murray sissy spacek robert duvall lucas black comedy drama mystery independent film
3364,11342,Warlock,steve miner julian sands lori singer richard e. grant mary woronov adventure comedy fantasy horror witch cemetery magic time travel aging curse warlock witch hunter
3365,241771,Beyond the Lights,gina prince-bythewood gugu mbatha-raw nate parker minnie driver machine gun kelly romance drama talent success musician woman director
3366,34653,A Single Man,tom ford colin firth julianne moore nicholas hoult matthew goode drama romance gay based on novel suicidal death of lover teacher student relationship grieving 1960s
3367,11051,The Last Temptation of Christ,martin scorsese willem dafoe harvey keitel barbara hershey david bowie drama christianity traitor jesus christ roman crucifixion longing moral conflict cross blasphemy temptation mary magdalene
3368,14578,Outside Providence,michael corrente shawn hatosy amy smart alec baldwin jon abrahams romance comedy drama suicide sex sexuality college police campus party love revenge prank independent film student teenager drug humiliation flashback accident
3369,57825,Bride & Prejudice,gurinder chadha aishwarya rai bachchan martin henderson naveen andrews daniel gillies drama comedy music romance indian lead bollywood modern day adaptation pride & prejudice woman director
3370,9555,Rabbit-Proof Fence,phillip noyce everlyn sampi tianna sansbury laura monaghan kenneth branagh adventure drama action history child abuse sister sister relationship prosecution australia approved school  based on true story independent film tracker survival outback colonialism australian aborigine australian outback aboriginal aborigine perth
3371,15581,Who's Your Caddy?,don michael paul mick partridge big boi sherri shepherd lil wayne comedy sport
3372,13006,Split Second,tony maylam rutger hauer kim cattrall michael j. pollard alastair duncan thriller action horror science fiction crime flooding futuristic police detective
3374,4251,Veer-Zaara,yash chopra shah rukh khan preity zinta rani mukerji amitabh bachchan drama romance love of one's life pilot class society pakistan india kashmir conflict
3375,12400,Redbelt,david mamet chiwetel ejiofor tim allen alice braga jose pablo cantillo drama film making film producer video surveillance sport interracial marriage auto accident instructor jujitsu movie star nightstick husband life relationship set up window smashing
3376,39053,Cyrus,jay duplass john c. reilly jonah hill marisa tomei catherine keener comedy drama romance mumblecore
3377,104896,A Dog Of Flanders,kevin brodie jack warden jeremy james kissner jesse james jon voight drama family 
3378,14112,Auto Focus,paul schrader greg kinnear willem dafoe rita wilson maria bello drama crime male nudity adultery based on novel infidelity tv show blow job video biography sex addiction based on true story independent film sex addict
3379,12271,Factory Girl,george hickenlooper sienna miller guy pearce hayden christensen mena suvari drama new york alcohol sex infidelity nudity artist gallery interview studio biography addiction party love independent film singer art drug gay man socialite scene film warhol
3380,71859,We Need to Talk About Kevin,lynne ramsay john c. reilly tilda swinton ezra miller siobhan fallon drama thriller suburb violence killing spree prison visit guinea pig broken arm potty training woman director
3381,226354,The Christmas Candle,john stephenson hans matheson samantha barks lesley manville sylvester mccoy drama family angel miracle village christian candle christmas
3382,48620,The Mighty Macs,tim chambers carla gugino ellen burstyn marley shelton david boreanaz action drama sport catholic mother superior catholic school convent school
3383,33676,Losin' It,"curtis hanson tom cruise jackie earle haley john stockwell john p. navin, jr. comedy male nudity female nudity mexico prostitute nudity high school locker room independent film teen sex comedy teenager canuxploitation virginity"
3384,37080,Mother and Child,rodrigo garcía naomi watts samuel l. jackson annette bening carla gallo drama romance adoptive mother nymphomaniac mother daughter relationship
3385,25388,March or Die,dick richards gene hackman terence hill catherine deneuve ian holm action adventure drama war gypsy middle east foreign legion wilderness archaeologist
3386,11687,The Visitors,jean-marie poiré jean reno valérie lemercier christian clavier marie-anne chazel fantasy comedy science fiction servant time travel clumsy fellow middle ages nobility
3387,39210,Somewhere,sofia coppola stephen dorff chris pontius erin wasson alexandra williams comedy drama milan independent film luxury hotel man in towel  woman director
3388,30128,I Hope They Serve Beer in Hell,bob gosse matt czuchry jesse bradford marika dominczyk traci lords comedy drama female nudity based on novel stripper flop dark comedy aftercreditsstinger
3389,31535,Chairman of the Board,alex zamm scott 'carrot top' thompson courtney thorne-smith larry miller jack warden comedy inventor invention scandal
3390,44835,Hesher,spencer susser joseph gordon-levitt natalie portman rainn wilson audrey wasilewski drama loss of mother clerk grocery loss of relative loss of wife briefs duringcreditsstinger
3391,192134,Dom Hemingway,richard shepard jude law demián bichir richard e. grant matthew c. martino comedy crime drama growing up money crime fatherhood
3393,24985,The Heart of Me,thaddeus o'sullivan helena bonham carter olivia williams paul bettany eleanor bron drama romance 
3394,306745,Freeheld,peter sollett julianne moore ellen page steve carell michael shannon romance drama new jersey equality lesbian relationship cancer
3395,47088,The Extra Man,shari springer berman kevin kline paul dano katie holmes john c. reilly comedy independent film woman director
3396,110402,Hard to Be a God,aleksey german leonid yarmolnik yuriy tsurilo natalya moteva aleksandr chutko drama science fiction 
3397,27004,Ca$h,stephen milburn anderson sean bean chris hemsworth victoria profeta thampy antony crime thriller comedy independent film money
3398,15013,Wah-Wah,richard e. grant gabriel byrne emily watson julie walters nicholas hoult drama adultery brain tumor south africa alcoholism divorce
3399,8374,The Boondock Saints,troy duffy willem dafoe norman reedus sean patrick flanery david della rocco action thriller crime arbitrary law boston twin brother russian mafia prologue irish police station pager duringcreditsstinger
3400,277519,Z Storm,david lam louis koo gordon lam ka-tung dada chan janelle sing crime thriller 
3401,78381,Twixt,francis ford coppola val kilmer bruce dern ben chaplin elle fanning horror thriller sheriff vampire orphanage writer edgar allen poe ghost murder mystery
3402,164372,The Snow Queen,vladlen barbe ivan okhlobystin dmitriy nagiev lyudmila artemeva anna ardova animation fantasy 
3403,294512,Alpha and Omega: The Legend of the Saw Tooth Cave,richard rich dee dee greene ben diskin lindsay torrance kate higgins family animation comedy adventure 
3404,8879,Pale Rider,clint eastwood clint eastwood michael moriarty carrie snodgress chris penn romance western gunslinger showdown marshal blackmail mine settler gold mining town violence killer preacher gold miner strange person
3405,13001,Stargate: The Ark of Truth,robert c. cooper ben browder amanda tapping christopher judge michael shanks adventure science fiction wormhole space travel supernatural powers spaceship alien
3406,9571,Dazed and Confused,richard linklater jason london rory cochrane wiley wiggins sasha jenson comedy drama 1970s texas high school comedy coming of age summer teenager period drama great soundtrack
3407,13649,High School Musical 2,kenny ortega zac efron vanessa hudgens ashley tisdale lucas grabeel comedy drama family music musical music summer teenager summer job country club
3408,325373,Two Lovers and a Bear,kim nguyen dane dehaan tatiana maslany gordon pinsent john ralston drama romance small town lovers bear north pole
3409,334527,Criminal Activities,jackie earle haley dan stevens john travolta michael pitt jackie earle haley thriller crime drama mobster money problems borrow trouble classmates investment bűnös utakon
3410,2211,Aimee & Jaguar,max färberböck maria schrader juliane köhler johanna wokalek heike makatsch drama history romance berlin jew forbidden love lesbian relationship homosexuality lesbian interest
3411,13919,The Chumscrubber,arie posin jamie bell camilla belle justin chatwin glenn close comedy drama suicide father son relationship surreal independent film parallel world
3412,14576,Shade,damian nieman stuart townsend gabriel byrne thandie newton jamie foxx action thriller crime 
3413,82505,House at the End of the Street,mark tonderai jennifer lawrence max thieriot elisabeth shue gil bellows horror thriller mother daughter relationship cross dressing violence mother son relationship father son conflict
3414,46738,Incendies,denis villeneuve lubna azabal mélissa désormeaux-poulin maxim gaudette rémy girard drama war mystery prison middle east rape muslim militia interpreter son christian orphanage swimming pool massacre checkpoint political assassination twins will
3415,38970,"Remember Me, My Love",gabriele muccino fabrizio bentivoglio laura morante monica bellucci silvio muccino drama comedy romance eroticism
3416,41009,Perrier’s Bounty,ian fitzgibbon cillian murphy brendan gleeson jim broadbent padraic delaney action comedy crime drama suspense
3417,7347,Elite Squad,josé padilha wagner moura caio junqueira andré ramiro milhem cortaz drama action crime slum police brutality brazilian war on drugs rio de janeiro drug traffic drug dealer torture by the police special forces law enforcement
3418,250546,Annabelle,john r. leonetti annabelle wallis ward horton tony amendola alfre woodard horror prequel evil doll killer doll spin off doll demonic possession killer toys toy comes to life
3419,38415,Bran Nue Dae,rachel perkins rocky mckenzie geoffrey rush jessica mauboy ernie dingo comedy drama foreign romance musical woman director
3420,650,Boyz n the Hood,john singleton laurence fishburne cuba gooding jr. ice cube morris chestnut crime drama street gang black people rap music hip-hop street war rapper violence in schools los angeles
3421,16620,La Bamba,luis valdez lou diamond phillips danielle von zerneck elizabeth peña rosanna desoto drama music musical death dying young nostalgic mexican american rising star marital rape
3422,25113,The Four Seasons,alan alda alan alda carol burnett len cariou sandy dennis comedy drama romance 
3423,11033,Dressed to Kill,brian de palma michael caine angie dickinson nancy allen keith gordon horror mystery thriller transvestism taxi prostitute subway shower one-night stand manipulation nightmare seduction photography friendship assault alter ego murder stalking violence psychiatrist interrogation desire guilt extramarital affair hitchcockian straight razor exhibitionism elevator dark secrets white gloves
3424,34723,The Adventures of Huck Finn,stephen sommers elijah wood courtney b. vance robbie coltrane jason robards action adventure drama family southern accent wanted man lynch mob reflection in water lesson nosebleed bloodhound fake accent grave digging
3425,9430,Go,doug liman sarah polley katie holmes jay mohr timothy olyphant crime comedy thriller ecstasy drug dealing drug reference to family circus high bisexual man multiple storylines
3426,8998,Friends with Money,nicole holofcener catherine keener jason isaacs timm sharp jennifer aniston comedy drama romance midlife crisis marriage money divorce fashion woman director
3427,10514,The Andromeda Strain,robert wise arthur hill david wayne james olson kate reid science fiction thriller nasa new mexico biological weapon epilepsy secret lab alien phenomenons chemistry biology suspense nuclear threat science
3428,10496,Bats,louis morneau lou diamond phillips dina meyer bob gunton leon robinson horror thriller mutation bat attack closed mine bat attack boy eaten
3429,1591,Nowhere in Africa,caroline link juliane köhler merab ninidze sidede onyulo matthias habich drama loss of family emigration world war ii jew national socialism kenia only child farm marriage crisis capture woman director emigrant
3430,76025,Shame,steve mcqueen michael fassbender carey mulligan james badge dale nicole beharie drama pornography brother sister relationship sex addiction new york city thirty something sex addict
3431,4836,Layer Cake,matthew vaughn daniel craig tom hardy colm meaney george harris drama thriller crime kidnapping ecstasy drug traffic drug mule hitman mission of murder planned murder drug smuggle exit murder
3432,14631,The Work and the Glory II: American Zion,sterling van wagenen sam hennings brenda strong eric johnson alexander carroll drama 
3433,87499,The East,zal batmanglij brit marling alexander skarsgård ellen page toby kebbell drama thriller secret organization murder environmentalism vanity film eco-terrorists multiple felonies
3434,18923,A Home at the End of the World,michael mayer colin farrell dallas roberts robin wright sissy spacek romance drama gay aids based on novel art house tantrum bisexual lgbt
3435,26665,Aberdeen,hans petter moland stellan skarsgård lena headey ian hart charlotte rampling drama comedy foreign alcohol cocaine daughter road trip independent film lawyer
3436,28089,The Messenger,oren moverman ben foster woody harrelson jena malone eamonn walker drama history independent film wounded soldier iraq war
3437,62255,Tracker,ian sharp ray winstone temuera morrison andy anderson gareth reeves action drama thriller adventure 
3438,5708,Control,anton corbijn sam riley samantha morton alexandra maria lara joe anderson drama manchester city medicine new love epilepsy wife punk recording contract record producer record label music independent film extramarital affair music band
3439,218,The Terminator,james cameron arnold schwarzenegger michael biehn linda hamilton paul winfield action thriller science fiction saving the world artificial intelligence rebel cyborg shotgun killer robot sun glasses dystopia car chase laser gun urban setting future war
3440,338,"Good bye, Lenin!",wolfgang becker daniel brühl katrin sass chulpan khamatova maria simon comedy drama romance bureaucracy berlin wall police state coma loss of mother wife husband relationship patriotism german democratic republic socialism news broadcast loss of father lenin single   filmes contra o comunismo
3441,21641,The Damned United,tom hooper michael sheen timothy spall colm meaney jim broadbent drama england leeds united sport brighton soccer cup derby county management soccer team
3442,10925,The Return of the Living Dead,dan o'bannon clu gulager james karen don calfa thom mathews comedy horror female nudity crematorium nudity punk company independent film undead decapitation zombie paramedic attic cemetary dismemberment warehouse stairs night of the living dead walking dead louisville
3443,2293,Mallrats,kevin smith jason lee jeremy london shannen doherty claire forlani romance comedy sex game show slacker shopping mall ex-boyfriend ex-girlfriend relationship jay and silent bob silent man coke bandleader aftercreditsstinger
3444,621,Grease,randal kleiser john travolta olivia newton-john stockard channing jeff conaway romance flying car street gang running graduation musical rivalry gossip makeover based on stage musical automobile racing nostalgic greaser wolf whistle school dance animated credits pep rally wrong side of the tracks mooning school principal
3445,792,Platoon,oliver stone tom berenger charlie sheen willem dafoe forest whitaker drama war action famous score hero mine vietnam war village gore jungle f word soldier battle combat 1960s
3446,1777,Fahrenheit 9/11,michael moore robert de niro michael moore george w. bush ben affleck documentary usa president jihad saudi arabia war on terror iraq government war steel helmet conspiracy theory
3447,642,Butch Cassidy and the Sundance Kid,george roy hill paul newman robert redford katharine ross strother martin history drama western crime wyoming historical figure loot sharing
3448,433,Mary Poppins,robert stevenson julie andrews dick van dyke david tomlinson glynis johns comedy family fantasy london england dancing parents kids relationship bank brother sister relationship famous score confidence nanny laughing magic chimney sweeper musical live action and animation
3449,16619,Ordinary People,robert redford donald sutherland mary tyler moore judd hirsch timothy hutton drama post traumatic stress  disorder depression suicide attempt grief dysfunctional family guilt death of son grieving
3450,1725,West Side Story,robert wise natalie wood richard beymer russ tamblyn rita moreno crime drama music slum street gang love at first sight showdown puerto rican immigrant highway forbidden love musical rivalry feud interracial relationship sondheim attempted rape policeman based on stage musical obsessive love lifting female in air young love modern day adaptation shakespeare in modern dress
3451,11977,Caddyshack,harold ramis chevy chase rodney dangerfield ted knight michael o'keefe comedy golf underwear sport golf course gopher
3452,20322,The Brothers,gary hardwick morris chestnut d. l. hughley bill bellamy shemar moore comedy drama romance independent film track and field gangster rap
3453,16158,The Wood,rick famuyiwa omar epps richard t. jones taye diggs malinda williams comedy drama romance 
3454,629,The Usual Suspects,bryan singer stephen baldwin gabriel byrne chazz palminteri kevin pollak drama crime thriller law relatives theft criminal criminal mastermind hungarian sibling
3455,10160,A Nightmare on Elm Street 5: The Dream Child,stephen hopkins robert englund lisa wilcox erika anderson valorie armstrong horror thriller nun baby monster asylum nightmare supernatural resurrection vision torture pregnancy birth disfigurement fetus womb dreams
3456,11452,National Lampoon’s Van Wilder,walt becker ryan reynolds tara reid tim matheson kal penn comedy romance male nudity female nudity sex college locker room doggystyle flirting exposé pug bon bon fraternity pledge greek letter laxative
3457,12163,The Wrestler,darren aronofsky mickey rourke marisa tomei evan rachel wood mark margolis drama romance supermarket heart attack ambition daughter wrestling sport stripper steroids fame barbed wire wrestler redemption
3458,32275,Duel in the Sun,king vidor jennifer jones joseph cotten gregory peck lionel barrymore western half breed
3459,13785,Best in Show,christopher guest jay brazeau parker posey michael hitchcock catherine o'hara comedy illinois pet shop poodle independent film mockumentary terrier kimono
3460,1103,Escape from New York,john carpenter kurt russell lee van cleef ernest borgnine donald pleasence science fiction action taxi street gang usa president war veteran hostage kidnapping liberation of prisoners anti hero gangster boss dystopia police operation attempt to escape cyberpunk reluctant hero
3461,36739,School Daze,spike lee samuel l. jackson laurence fishburne giancarlo esposito tisha campbell-martin comedy drama musical
3462,14144,Daddy Day Camp,fred savage cuba gooding jr. tamala jones paul rae lochlyn munro comedy family competition grandfather grandson relationship vomit summer camp toilet rivalry colonel
3463,10622,Mr. Nice Guy,sammo hung jackie chan richard norton miki lee gabrielle fitzpatrick crime action comedy journalist martial arts cook drug dealer
3464,13370,A Mighty Wind,christopher guest bob balaban christopher guest john michael higgins eugene levy comedy music mockumentary folk singer
3465,11191,Mystic Pizza,donald petrie annabeth gish julia roberts lili taylor vincent d'onofrio comedy drama romance independent film commitment lobster portuguese american
