,id,title,all
2147,48289,The Debt,john madden helen mirren ciarán hinds tom wilkinson jessica chastain drama thriller beach mossad secret agent insane asylum lye syringe lost of friend
2148,243,High Fidelity,stephen frears john cusack iben hjejle todd louiso jack black comedy drama romance music chicago music record rock and roll record store soul disc jockey pop bruce frederick joseph springsteen record collection
2149,6933,One Missed Call,eric valette shannyn sossamon edward burns ana claudia talancón ray wise horror mystery thriller candy loss of sister mobile phone answering machine dying and death victim death of a friend sms asthma friendship police delusion remake cowardliness train
2150,17182,Eye for an Eye,john schlesinger sally field kiefer sutherland ed harris beverly d'angelo drama thriller rape gun self-defense grieving parents
2151,8848,The Bank Job,roger donaldson jason statham saffron burrows stephen campbell moore daniel mays thriller crime drama infidelity subway car dealer vault mannequin bahamas strip club wife offer photography london underground based on true story extortion double cross walkie talkie railway station jackhammer political corruption bank heist cabinet officer corrupt policeman
2152,38,Eternal Sunshine of the Spotless Mind,michel gondry jim carrey kate winslet kirsten dunst mark ruffalo science fiction drama romance deja vu regret jealousy amnesia dream operation relationship problems love memory brainwashing relationship heartbreak nonlinear timeline love story bittersweet
2153,38303,You Again,andy fickman kristen bell sigourney weaver betty white kristin chenoweth comedy romance brother sister relationship marriage bully duringcreditsstinger
2154,1266,Street Kings,david ayer keanu reeves forest whitaker chris evans hugh laurie action crime drama thriller police los angeles
2155,107985,The World's End,edgar wright simon pegg nick frost martin freeman eddie marsan comedy action science fiction end of the world apocalypse trilogy homage
2156,14043,Nancy Drew,andrew fleming emma roberts josh flitter max thieriot rachael leigh cook action adventure crime family mystery thriller california detective based on novel dream kidnapping chase party murder rescue escape hollywood teenager explosion surveillance flashback
2157,19901,Daybreakers,michael spierig ethan hawke sam neill willem dafoe claudia karvan fantasy horror action thriller science fiction female nudity sunrise waitress experiment rain sunlight vampire dystopia beautiful woman slow motion scene undead decapitation scientist epidemic night creatures
2158,34016,She's Out of My League,jim field smith alice eve jay baruchel mike vogel krysten ritter comedy romance confidence romantic comedy dating insecurity airport security unlikely lovers twenty something duringcreditsstinger
2159,59860,Monte Carlo,thomas bezucha selena gomez katie cassidy cory monteith leighton meester adventure comedy romance monte carlo mistaken identity look-alike young woman texan american abroad
2160,10069,Stay Alive,william brent bell jon foster samaire armstrong frankie muniz jimmi simpson horror thriller video game hacker virtual reality virtual fight baroness
2161,9588,Quigley Down Under,simon wincer tom selleck laura san giacomo alan rickman chris haywood romance action adventure western drama australian chase
2162,12819,Alpha and Omega,ben gluck hayden panettiere justin long dennis hopper christina ricci family animation wolf arranged marriage forbidden love road trip park park ranger howling social status
2163,9954,The Covenant,renny harlin steven strait laura ramsey jessica lucas taylor kitsch action adventure fantasy horror science fiction thriller magic male friendship college supernatural powers teenager
2164,10115,Stick It,jessica bendinger jeff bridges missy peregrym vanessa lengies maddy curley comedy drama gymnastics trainer puberty training sport teenager woman director
2165,25132,Shorts,robert rodriguez jimmy bennett kat dennings jolie vanier william h. macy comedy family 
2166,577,To Die For,gus van sant nicole kidman matt dillon joaquin phoenix casey affleck fantasy drama comedy thriller adultery winter obsession television new hampshire narcissistic personality disorder
2167,328387,Nerve,henry joost emma roberts dave franco emily meade miles heizer mystery adventure crime based on novel technology internet hacking teenager new york city game adaptation dare cellphone video based on young adult novel smartphone taking a risk
2168,12690,Appaloosa,ed harris viggo mortensen ed harris renée zellweger jeremy irons drama western crime small town rancher
2169,9945,Vampires,john carpenter james woods daniel baldwin sheryl lee thomas ian griffith action drama fantasy horror thriller based on novel new mexico party vampire hunter revenge priest church skull team crucifix cross relic vampire slayer turning into a vampire drinking blood
2170,539,Psycho,alfred hitchcock anthony perkins vera miles john gavin janet leigh drama horror thriller hotel clerk arizona shower rain motel money secretary corpse murderer theft private detective proto-slasher
2171,13596,My Best Friend's Girl,howard deutch dane cook kate hudson alec baldwin jason biggs romance comedy date sex bar test friendship insult stripper blonde liar wedding lap dance duringcreditsstinger
2172,226857,Endless Love,shana feste alex pettyfer gabriella wilde robert patrick rhys wakefield drama romance teenage romance
2173,13159,Georgia Rule,garry marshall jane fonda lindsay lohan felicity huffman dermot mulroney comedy drama romance grandmother granddaughter relationship promiscuity mother daughter relationship summer teenager rural veterinary clinic rebellious teenager
2174,47941,Under the Rainbow,steve rash chevy chase carrie fisher eve arden joseph maher comedy 
2175,526,Ladyhawke,richard donner matthew broderick rutger hauer michelle pfeiffer alfred molina adventure drama fantasy romance moon monk swordplay bishop cathedral falcon twilight solar eclipse thief
2176,22796,Simon Birch,mark steven johnson jim carrey ashley judd ian michael smith joseph mazzello comedy drama family illegitimate son
2177,2355,Reign Over Me,mike binder adam sandler don cheadle jada pinkett smith liv tyler drama confidence trauma leaving one's family childhood memory airplane war on terror music loss of daughter alone cowardliness family
2178,5915,Into the Wild,sean penn emile hirsch marcia gay harden william hurt jena malone adventure drama male nudity parents kids relationship camping cutting the cord self-discovery wilderness biography based on true story pubic hair alaska journey
2179,9842,School for Scoundrels,todd phillips billy bob thornton jon heder jacinda barrett sarah silverman comedy drama romance date competition lovesickness mentor traffic policeman
2180,61012,Silent Hill: Revelation 3D,michael j. bassett adelaide clemens kit harington sean bean carrie-anne moss thriller horror mystery female protagonist another dimension based on video game mall occult ritual dark carnival occult torture aftercreditsstinger 3d
2181,755,From Dusk Till Dawn,robert rodriguez george clooney quentin tarantino harvey keitel juliette lewis horror action thriller crime dancing brother brother relationship sexual obsession showdown sheriff eroticism nudity bank robber vampire holy water siege stripper priest explosion extreme violence bank robbery preacher hostage situation crucifix recreational vehicle blood spurting convenience store female vampire mexican american border nightclub entertainer boa constrictor
2182,13682,Pooh's Heffalump Movie,frank nissen jim cummings john fiedler nikita hopkins kath soucie animation family 
2183,9089,Home for the Holidays,jodie foster holly hunter robert downey jr. anne bancroft charles durning comedy drama romance baltimore thanksgiving family clan family conflict generations conflict woman director
2184,9470,Kung Fu Hustle,stephen chow stephen chow yuen wah yuen qiu lam tze-chung action comedy crime fantasy kung fu magic mafia defense gangster policeman anarchic comedy
2185,18357,The Country Bears,peter hastings haley joel osment diedrich bader candy ford james gammon adventure comedy family human animal relationship musical clowning bear social satire aftercreditsstinger duringcreditsstinger
2186,7979,The Kite Runner,marc forster khalid abdalla atossa leoni shaun toub zekeria ebrahimi drama 1970s afghanistan hang gliding war in afghanistan taliban cowardice best friend cowardliness child
2187,470,21 Grams,alejandro gonzález iñárritu sean penn naomi watts benicio del toro danny huston drama crime thriller life and death transplantation suicide attempt desperation loss of family ex-detainee sadness rage and hate car crash
2188,15644,Paparazzi,paul abascal cole hauser robin tunney dennis farina daniel baldwin action drama thriller independent film
2189,9582,A Guy Thing,chris koch jason lee julia stiles selma blair james brolin comedy romance infidelity bachelor blackmail fantasy truth party liar friends misunderstanding wedding fiancée
2190,10642,Loser,amy heckerling jason biggs mena suvari zak orth thomas sadoski drama comedy romance family college lost and found older brother younger sister woman director young adult college student
2191,22074,Capitalism: A Love Story,michael moore michael moore thora birch william black elijah cummings documentary usa capitalism capitalist wall street criticism and blame banking money economics corporation
2192,2428,The Greatest Story Ever Told,george stevens max von sydow michael anderson jr. carroll baker ina balin drama history jesus christ biography epic
2193,290751,Secret in Their Eyes,billy ray chiwetel ejiofor nicole kidman julia roberts dean norris crime drama mystery fbi missing child
2194,13805,Disaster Movie,jason friedberg matt lanter vanessa lachey nicole ari parker crista flanagan action comedy natural disaster violence mortal danger duringcreditsstinger
2195,4597,Armored,nimród antal columbus short laurence fishburne skeet ulrich amaury nolasco action crime drama thriller robbery homeless person bank armored car truck heist
2196,9414,The Man Who Knew Too Little,jon amiel bill murray peter gallagher joanne whalley alfred molina comedy thriller crime action london england bomb brother brother relationship helicopter based on novel bank tv show theatre milieu mistaken identity escape agent
2197,63492,What's Your Number?,mark mylod chris evans anna faris martin freeman chris pratt comedy romance based on novel loser magazine womanizer mission search boyfriend husband fired past relationship
2198,81796,Lockout,stephen st. leger guy pearce maggie grace joseph gilgun lennie james action thriller science fiction usa president anti hero dementia future space convict interrogation space station collision in space year 2079
2199,10710,Envy,barry levinson ben stiller jack black rachel weisz christopher walken comedy jealousy inventor neighbor best friend milliionaire dog envy golden egg
2200,15092,Crank: High Voltage,brian taylor jason statham amy smart dwight yoakam efren ramirez action thriller crime female nudity prostitute horse race heart strip club electric shock godzilla sequel tourette syndrome gang shootout public sex cigarette smoking mansion electrocution foot chase surgery taser duringcreditsstinger flashback absurdism ultraviolence
2201,11382,Bullets Over Broadway,woody allen john cusack dianne wiest jennifer tilly chazz palminteri action comedy thriller lover (female) talent mafia boss author
2202,15005,One Night with the King,michael o. sajbel tiffany dupont peter o'toole luke goss john noble drama based on novel persia queen esther
2203,8198,The Quiet American,phillip noyce michael caine brendan fraser đỗ thị hải yến tzi ma drama action thriller romance terror journalist lover (female) saigon indochina
2204,6963,The Weather Man,gore verbinski nicolas cage michael caine hope davis gemmenne de la peña comedy drama new york chicago midlife crisis television daughter father weatherman terminal illness wettermann
2205,15070,Undisputed,walter hill wesley snipes ving rhames peter falk michael rooker action adventure drama thriller sport
2206,12797,Ghost Town,david koepp ricky gervais greg kinnear téa leoni billy campbell comedy fantasy romance dying and death misanthrope lecture cardiopulmonery resuscitation
2207,17134,12 Rounds,renny harlin john cena aidan gillen ashley scott steve harris action adventure drama thriller police cops cat and mouse family revenge drama
2208,41402,Let Me In,matt reeves kodi smit-mcphee chloë grace moretz richard jenkins elias koteas drama horror mystery vampire child vampire remake bully young boy biting dead boy hammer horror 1980s
2209,18885,3 Ninjas Kick Back,charles t. kanganis victor wong max elliott slade sean fox j. evan bonifant adventure action comedy family underdog hero friendship treasure hunt friends revenge rivalry good vs evil youth danger escapade young heroes siblings relations vigilantism heroic mission buddies master villain master warrior contests and competitions
2210,4953,Be Kind Rewind,michel gondry jack black yasiin bey danny glover mia farrow drama comedy camcorder videoband delusion nuclear power plant video store
2211,10773,Mrs Henderson Presents,stephen frears judi dench bob hoskins will young christopher guest comedy drama world war ii widow musical theatre milieu nacktrevue variety
2212,146198,Triple 9,john hillcoat casey affleck chiwetel ejiofor woody harrelson kate winslet action thriller heist betrayal dirty cop
2213,2639,Deconstructing Harry,woody allen woody allen kirstie alley billy crystal judy davis comedy drama new york writer's block insanity independent film author
2214,10563,Three to Tango,damon santostefano matthew perry neve campbell dylan mcdermott oliver platt comedy romance gay dance architect artist tango business man spying partnership chief executive officer deception business partner affair
2215,295964,Burnt,john wells bradley cooper sienna miller lily james alicia vikander drama london england cook restaurant diva career kitchen redemption drug drug addict chef come back
2216,5971,We're No Angels,neil jordan robert de niro sean penn demi moore hoyt axton comedy crime drama prison prisoner independent film
2217,9716,Everyone Says I Love You,woody allen drew barrymore diva gray natasha lyonne edward norton music comedy romance paris venice adultery robbery lovesickness dancer airport broken engagement infidelity montmartre winter marriage proposal new love restaurant gondola halloween racehorse lover musical grandfather thanksgiving senility tourist jogging atheist dysfunctional family independent film family relationships mistaken identity wealth redemption unfaithfulness hospital lingerie slip escaped convict singing maid new york city divorce urban setting christmas eve cult film waiter wake jewelry store unwanted kiss funeral home central park ghost opposites attract engagement ring jumping rope autumn trick or treating flashback park avenue parolee x-ray jeweler fiancée
2218,11835,Death Sentence,james wan kevin bacon garrett hedlund kelly preston jordan garrett action crime drama thriller loss of son repayment revenge murder gang police officer killed hospital extreme violence justice hoodlum semiautomatic pistol finger gun
2219,26171,Everybody's Fine,kirk jones robert de niro drew barrymore kate beckinsale sam rockwell drama family relationships doctor retired visit widower duringcreditsstinger heart trouble
2220,31117,Superbabies: Baby Geniuses 2,bob clark jon voight scott baio vanessa angel skyler shaye comedy family baby baseball scientific study computer genius mind control good vs evil baby geniuses
2221,9074,The Man,les mayfield samuel l. jackson eugene levy luke goss miguel ferrer action comedy crime mistake in person false identity arms dealer cop police officer dentist
2222,14396,Code Name: The Cleaner,les mayfield cedric the entertainer lucy liu nicollette sheridan mark dacascos action comedy crime 
2223,15673,Connie and Carla,michael lembeck nia vardalos toni collette david duchovny stephen spinella comedy gay drag queen mistaken identity
2224,42618,Sweet Charity,"bob fosse shirley maclaine john mcmartin ricardo montalban sammy davis, jr. comedy drama music romance broken engagement charity celebrity tragic love dancehall girl based on stage musical based on film"
2225,171274,Inherent Vice,paul thomas anderson joaquin phoenix josh brolin owen wilson katherine waterston comedy romance crime drama mystery based on novel 1970s private investigator smoking marijuana los angeles 1960s
2226,24432,Doogal,frank passingham daniel tay jimmy fallon jon stewart whoopi goldberg family 
2227,109417,Battle of the Year,benson lee josh holloway josh peck chris brown laz alonso music drama musical 3d
2228,13948,An American Carol,david zucker kevin farley kelsey grammer leslie nielsen trace adkins comedy fantasy terrorist parody documentary filmmaker sattire
2229,106747,Machete Kills,robert rodriguez danny trejo mel gibson amber heard michelle rodriguez action crime thriller mexico white house nuclear missile machete outer space
2230,10929,Willard,glen morgan crispin glover r. lee ermey laura harring jackie burroughs horror bad boss evil mother revenge humiliation obedience
2231,14220,Strange Wilderness,fred wolf steve zahn allen covert jonah hill kevin heffernan comedy tv show bigfoot
2232,46435,Topsy-Turvy,mike leigh allan corduner jim broadbent timothy spall dexter fletcher comedy drama music prostitute musical biography telephone call cigar smoking drink  gilbert and sullivan gilbert and sullivan's princess ida piano duet lyricist exhibition
2233,256962,Little Boy,alejandro monteverde jakob salvati emily watson cary-hiroyuki tagawa michael rapaport comedy drama war japanese world war ii spirituality
2234,48231,A Dangerous Method,david cronenberg keira knightley viggo mortensen michael fassbender sarah gadon drama thriller based on novel psychoanalysis sigmund freud biography spanking based on play cigar smoking cheating husband based on true events
2235,3509,A Scanner Darkly,richard linklater keanu reeves winona ryder woody harrelson robert downey jr. animation science fiction thriller california detective based on novel dream undercover cocaine brain exam future test dystopia assignment cyberpunk drug surveillance totalitarian corporation substance schizophrenic condition neo-noir
2236,82684,Chasing Mavericks,curtis hanson gerard butler jonny weston elisabeth shue abigail spencer drama wave surfing sport mentor protégé relationship santa cruz california
2237,12142,Alone in the Dark,uwe boll christian slater tara reid stephen dorff frank c. turner action fantasy horror thriller detective monster professor island museum darkness alien life-form paranormal artifact slow motion scene flashback sequence zombie based on video game occultism
2238,23367,Bandslam,todd graff vanessa hudgens aly michalka gaelan connell lisa kudrow comedy drama family music new jersey musical battle of the bands teenager rock band
2239,10740,Birth,jonathan glazer nicole kidman cameron bright danny huston lauren bacall drama mystery thriller loss of husband reincarnation friends little boy independent film wedding
2240,241239,A Most Violent Year,j.c. chandor oscar isaac jessica chastain albert brooks elyes gabel crime drama thriller corruption capitalism winter american dream immigrant business ethics truck oil lawyer new york city loan shark coat tunnel 1980s husband wife relationship truck hijacking bank loan
2241,14582,Passchendaele,paul gross paul gross caroline dhavernas joe dinicol meredith bailey drama romance war history nurse battle platoon veteran recruitment
2242,14914,Flash of Genius,marc abraham aaron abrams alan alda lauren graham greg kinnear drama biography
2243,3902,I'm Not There.,todd haynes cate blanchett heath ledger julianne moore ben whishaw drama music rock and roll music style success john f. kennedy advancement bob dylan rock biography music beatnik motor-bike accident
2244,77948,The Cold Light of Day,mabrouk el mechri henry cavill verónica echegui sigourney weaver bruce willis action thriller kidnapping spying government
2245,21755,The Brothers Bloom,rian johnson rachel weisz adrien brody mark ruffalo rinko kikuchi adventure comedy drama romance con man estafa
2246,4960,"Synecdoche, New York",charlie kaufman philip seymour hoffman samantha morton jennifer jason leigh michelle williams drama new york man-woman relation writer
2247,128,Princess Mononoke,hayao miyazaki yōji matsuda yuriko ishida yūko tanaka kaoru kobayashi adventure fantasy animation fight wolf village and town iron pan wild boar territory friendship princess good vs evil anime
2248,14652,Bon voyage,jean-paul rappeneau grégori derangère gérard depardieu isabelle adjani virginie ledoyen comedy drama foreign 
2249,40932,Can't Stop the Music,nancy walker alex briley david hodo glenn hughes randy jones comedy music camp disco woman director village people
2250,16608,The Proposition,john hillcoat guy pearce ray winstone emily watson danny huston action adventure crime drama thriller western gallows australia psychopath outlaw misanthrope gang shootout sadist brutality violence hideout retribution flogging whipping sunset aborigine savagery
2251,334531,My All American,angelo pizzo aaron eckhart finn wittrock robin tunney sarah bolger drama american football biography sport championship
2252,32316,Marci X,richard benjamin lisa kudrow damon wayans richard benjamin jane krakowski comedy 
2253,7299,Equilibrium,kurt wimmer christian bale taye diggs emily watson angus macfadyen action science fiction thriller resistance fascism totalitarian regime destroy phasing dystopia book burning outlaw government agent
2255,19457,The Yards,james gray mark wahlberg joaquin phoenix charlize theron james caan drama action thriller crime corruption subway infiltration criminal
2256,112937,The Oogieloves in the Big Balloon Adventure,matthew diamond christopher lloyd cary elwes jaime pressly cloris leachman family 
2257,314385,By the Sea,angelina jolie angelina jolie brad pitt mélanie laurent melvil poupaud drama romance france hotel 1970s grief travel unhappiness marriage problems woman director
2258,8953,Steamboy,katsuhiro ōtomo anne suzuki masane tsukayama katsuo nakamura manami konishi animation fantasy science fiction england inventor ball boy industrial revolution kugel steampunk energy 19th century steam
2259,29078,The Game of Their Lives,david anspaugh gerard butler wes bentley gavin rossdale costas mandylor drama sport
2260,46503,All Good Things,andrew jarecki kirsten dunst ryan gosling kristen wiig frank langella drama mystery thriller crime romance difficult childhood patriarch childhood trauma dysfunctional marriage
2261,10448,Rapa Nui,kevin reynolds jason scott lee esai morales sandrine holt eru potaka-dewes adventure in love with enemy indigenous island
2262,13688,CJ7,stephen chow stephen chow xu jiao kitty zhang yuqi lam tze-chung comedy drama family fantasy science fiction little boy ufo extraterrestrial
2263,10353,The Visitors II: The Corridors of Time,jean-marie poiré christian clavier jean reno marie-anne chazel christian bujeau comedy fantasy mephisto french revolution time travel leap in time knight wedding middle ages
2264,43935,Dylan Dog: Dead of Night,kevin munroe brandon routh peter stormare sam huntington taye diggs action comedy horror mystery science fiction thriller detective vampire supernatural zombie werewolf ghouls
2265,11458,People I Know,daniel algrant al pacino kim basinger ryan o'neal téa leoni drama thriller drug addiction press release from prison women's prison party exzess independent film drug intrigue
2266,44638,The Tempest,julie taymor helen mirren felicity jones reeve carney david strathairn drama fantasy shakespeare sword island frog sorcery banishment spirit storm staff woman director sorceress loincloth
2267,241257,Regression,alejandro amenábar ethan hawke emma watson david thewlis lothaire bluteau horror mystery thriller investigation memory loss
2268,14538,Three Kingdoms: Resurrection of the Dragon,daniel lee sammo hung vanness wu maggie q andy lau action history drama warrior woman number in title
2269,13250,Butterfly on a Wheel,mike barker pierce brosnan maria bello gerard butler emma karwandy crime drama thriller chicago infidelity man-woman relation revenge
2270,133931,Zambezia,wayne thornley jeremy suarez samuel l. jackson abigail breslin leonard nimoy comedy animation adventure family falcon bird origin
2271,280871,Ramanujan,gnana rajasekaran abhinay vaddi suhasini maniratnam kevin mcgowan abbas drama history mathematician biography prodigy ramanujam math genius
2272,239897,Dwegons,tom walsh melissa leo maggie wheeler joey d. vieira r. martin klein animation 
2273,184341,Hands of Stone,jonathan jakubowicz robert de niro edgar ramírez jurnee smollett ellen barkin drama 
2274,334074,Survivor,james mcteigue pierce brosnan milla jovovich dylan mcdermott angela bassett thriller new year's eve fire showdown terrorist embassy hand grenade truck laboratory on the run orphan death cigarette lighter microscope hazmat suit
2275,199373,The Frozen Ground,scott walker nicolas cage vanessa hudgens john cusack radha mitchell thriller crime gun escape serial killer man hunt hunting
2276,14202,The Painted Veil,john curran edward norton juliet howland naomi watts ian renwick drama romance china cholera foreign aid epidemic loveless marriage
2277,6968,The Baader Meinhof Complex,uli edel martina gedeck moritz bleibtreu johanna wokalek nadja uhl action crime drama history thriller terror raf 1970s
2278,581,Dances with Wolves,kevin costner kevin costner mary mcdonnell graham greene rodney a. grant adventure drama western countryside based on novel suicide attempt culture clash loss of family deserter interpreter language barrier self-discovery dakota buffalo chief unsociability freedom native american 19th century lakota
